{
  "schema_version": 1,
  "id": "rslive_content",
  "display_name": "RS Live Content",
  "description": "Редакционная политика для живого русскоязычного справочного контента: конкретика, естественный русский, низкий маркетинговый пафос.",
  "reviewer_weights": {
    "native": 1.0,
    "ilyakhov": 1.0,
    "gal": 0.9,
    "chukovsky": 0.85
  },
  "conflict_policy": "show_alternatives",
  "preserve_author_voice": true,
  "default_reviewers": ["native", "ilyakhov", "gal", "chukovsky"],
  "preferences": {
    "concreteness": "high",
    "information_density": "high",
    "colloquiality": "medium",
    "imagery": "medium",
    "marketing_pathos": "low"
  }
}
