{
  "schema_version": 1,
  "id": "neutral",
  "display_name": "Нейтральный",
  "description": "Сохраняет естественный русский и показывает разногласия редакторов без агрессивного схлопывания.",
  "reviewer_weights": {
    "native": 1.0
  },
  "conflict_policy": "show_alternatives",
  "preserve_author_voice": true,
  "default_reviewers": ["native"]
}
